"Status","Start Time","Stop Time","Duration in ms","Parent Suite","Suite","Sub Suite","Test Class","Test Method","Name","Description"
"broken","Sat Jun 08 16:17:31 GMT 2024","Sat Jun 08 16:18:31 GMT 2024","60298","","","","ProjectTests","MessageInProjectDelConformationWindow","MessageInProjectDelConformationWindow","Verifying the message text in the project deletion confirmation window"
"broken","Sat Jun 08 16:16:28 GMT 2024","Sat Jun 08 16:17:31 GMT 2024","63006","","","","LoginTests","LoginWithEmptyUserNameAndShortPassword","LoginWithEmptyUserNameAndShortPassword","Check the error messages if username is empty and password is less than 5 characters"
"broken","Sat Jun 08 16:17:31 GMT 2024","Sat Jun 08 16:18:31 GMT 2024","60230","","","","ProjectTests","ProjectExistsAfterRefusalDeleteIt","ProjectExistsAfterRefusalDeleteIt","Verifying if the project is in the list if you refused to delete it"
"broken","Sat Jun 08 16:16:28 GMT 2024","Sat Jun 08 16:17:31 GMT 2024","62907","","","","LoginTests","LoginWithShortPassword","LoginWithShortPassword","Check the error message if password is less than 5 characters"
"broken","Sat Jun 08 16:17:31 GMT 2024","Sat Jun 08 16:18:31 GMT 2024","60149","","","","ProjectTests","AddProjectWithModel","AddProjectWithModel","Verifying a project with model data has been added"
"broken","Sat Jun 08 16:17:31 GMT 2024","Sat Jun 08 16:18:31 GMT 2024","60225","","","","ProjectTests","DeleteAddedProject","DeleteAddedProject","Verifying an added project has been deleted"
"broken","Sat Jun 08 16:16:28 GMT 2024","Sat Jun 08 16:17:30 GMT 2024","62806","","","","ProjectTests","AddProjectWithEmptyName","AddProjectWithEmptyName","Verifying the error message when trying to create a project with an empty name"
"broken","Sat Jun 08 16:16:28 GMT 2024","Sat Jun 08 16:17:30 GMT 2024","62809","","","","LoginTests","LoginWithoutUserNameAndPassword","LoginWithoutUserNameAndPassword","Check the error messages if username and password are not entered"
